{
  "status": "onboarding_incomplete",
  "checked_at": "2026-05-21T19:46:04.067Z",
  "account_allocation": "account_a",
  "live_ingestion_enabled": false,
  "scheduled_monitoring_enabled": false,
  "network_execution_enabled": false,
  "readiness": {
    "supabase_required_ready": false,
    "supabase_optional_ready": false,
    "cloudflare_ready": false,
    "github_optional_ready": false,
    "uptime_manual_setup_required": true
  },
  "services": [
    {
      "service": "supabase",
      "role": "required",
      "fields": [
        {
          "key": "SUPABASE_URL",
          "present": false
        },
        {
          "key": "SUPABASE_PROJECT_REF",
          "present": false
        },
        {
          "key": "SUPABASE_DB_URL",
          "present": false
        },
        {
          "key": "SUPABASE_ANON_KEY",
          "present": false
        },
        {
          "key": "SUPABASE_SERVICE_ROLE_KEY",
          "present": false
        }
      ]
    },
    {
      "service": "cloudflare",
      "role": "required_for_worker_runtime",
      "fields": [
        {
          "key": "CLOUDFLARE_ACCOUNT_ID",
          "present": false
        },
        {
          "key": "CLOUDFLARE_API_TOKEN",
          "present": false
        },
        {
          "key": "CLOUDFLARE_WORKER_NAME",
          "present": false
        }
      ]
    },
    {
      "service": "github",
      "role": "optional",
      "fields": [
        {
          "key": "GITHUB_TOKEN",
          "present": false
        },
        {
          "key": "GH_TOKEN",
          "present": false
        },
        {
          "key": "GITHUB_FINE_GRAINED_TOKEN",
          "present": false
        }
      ]
    },
    {
      "service": "uptimerobot",
      "role": "manual_external",
      "fields": [
        {
          "key": "operator_setup",
          "present": false
        }
      ]
    }
  ],
  "safety_flags": {
    "regwatch_apply_supabase_schema": false,
    "regwatch_enable_live_ingestion": false,
    "regwatch_enable_scheduled_monitoring": false,
    "regwatch_enable_network_execution": false,
    "cloudflare_enable_worker_deploy": false,
    "cloudflare_enable_cron_trigger": false
  },
  "local_env_files": {
    "env_runtime_local": true,
    "env_cloudflare_local": false,
    "env_github_local": false
  },
  "next_required_action": "Copy .env.runtime.example to .env.runtime.local and add Supabase credentials for Account A project caesar-regulation-watch-dev (hub policy). Do not commit local env files.",
  "public_note": "Metadata-only services onboarding readiness. No emails, tokens, keys, database URLs, or hosts in this export. Exact account emails live only in hub .local/ files and ignored local env."
}
